{
  "run_id": "20261016T075147Z-6d019de6e2f2",
  "captured_at": "2026-10-16T07:51:47.555754+00:00",
  "evaluated_at": "2026-10-16T08:04:10Z",
  "execution_status": "COMPLETE",
  "evidence_identity": "BOUND",
  "hypothesis_status": "SUPPORTED",
  "assertion_outcomes": {
    "baseline-healthy": "SUPPORTED",
    "deployment-reported-success": "SUPPORTED",
    "fault-config-applied": "SUPPORTED",
    "fault-config-activated": "SUPPORTED",
    "symptom-runtime-5xx": "SUPPORTED",
    "discriminating-import-error": "SUPPORTED",
    "recovery-healthy": "SUPPORTED"
  },
  "generated_verdict_claimed": null,
  "generated_verdict_rejected": false
}
