{
  "run_id": "20261016T154910Z-a034cccd79d6",
  "captured_at": "2026-10-16T15:49:10.528138+00:00",
  "evaluated_at": "2026-10-16T15:57:17Z",
  "execution_status": "COMPLETE",
  "evidence_identity": "BOUND",
  "hypothesis_status": "INCONCLUSIVE",
  "assertion_outcomes": {
    "baseline-outbound-succeeds": "SUPPORTED",
    "symptom-transport-failures-appear": "SUPPORTED",
    "control-destination-bound-to-workload": "SUPPORTED",
    "discriminating-snat-port-pressure": "INCONCLUSIVE",
    "discriminating-destination-stays-healthy": "SUPPORTED",
    "discriminating-http-errors-absent": "SUPPORTED",
    "discriminating-pooling-reduces-transport-failures": "CONTRADICTED",
    "recovery-outbound-succeeds-again": "CONTRADICTED"
  },
  "generated_verdict_claimed": null,
  "generated_verdict_rejected": false
}
